[
 {
  "role": "driver",
  "pos": {
   "x": -0.6,
   "y": 1.25,
   "z": 1.5
  },
  "radius": 0.25,
  "health": 100
 },
 {
  "role": "radio_operator",
  "pos": {
   "x": 0.6,
   "y": 1.25,
   "z": 1.5
  },
  "radius": 0.25,
  "health": 100
 },
 {
  "role": "gunner",
  "pos": {
   "x": 0.45,
   "y": 2.15,
   "z": 0.1
  },
  "radius": 0.25,
  "health": 100
 },
 {
  "role": "commander",
  "pos": {
   "x": 0.45,
   "y": 2.27,
   "z": -0.6
  },
  "radius": 0.25,
  "health": 100
 },
 {
  "role": "loader",
  "pos": {
   "x": -0.5,
   "y": 2.15,
   "z": -0.2
  },
  "radius": 0.25,
  "health": 100
 }
]
